{
  "adoptionRecords": [],
  "asOf": "2026-08-20T19:08:46Z",
  "boundaries": {
    "adoptionRecorded": false,
    "artifactAcquisitionPerformed": false,
    "artifactExecutionPerformed": false,
    "automaticAction": false,
    "buildNetworkUsed": false,
    "credentialAccessed": false,
    "evaluationResultRecorded": false,
    "fullTextIncluded": false,
    "guestAdmitted": false,
    "metadataTitlesAreScientificClaims": false,
    "moduleCreated": false,
    "preflightPerformed": false,
    "scalarScoreUsed": false,
    "signatureCreated": false,
    "trialAuthorityIssued": false,
    "trialRunRecorded": false,
    "useAuthorityIssued": false
  },
  "contractVersion": "0.1.0",
  "counts": {
    "adoptionRecords": 0,
    "evaluationPlans": 3,
    "evaluationRequests": 3,
    "evaluationResults": 0,
    "preflights": 0,
    "referrals": 4,
    "trialAuthorities": 0,
    "trialRuns": 0,
    "useAuthorities": 0
  },
  "evaluationPlans": [
    {
      "authorship": {
        "compiledBy": "codex-assisted-publication",
        "exactTextHumanReviewed": false,
        "humanDirectionRecorded": true,
        "origin": "maintainer-authorized-assisted-draft"
      },
      "controls": [
        "Freeze one self-authored registry, planted-change labels, age/activity/category strata, audit budget, and all policies before a future comparison.",
        "Give uniform, recency-only, score-only, and coverage-balanced policies the identical audit budget.",
        "Keep one separately authored fixture held out until policies and measures are frozen."
      ],
      "criterionRules": [
        {
          "condition": "Coverage-balanced review exposes more planted change patterns than every baseline under the same budget on the held-out fixture.",
          "interpretation": "retain-as-bounded-comparative-evidence"
        },
        {
          "condition": "One or more baselines expose an equal or greater number of planted patterns.",
          "interpretation": "retain-as-no-observed-increment"
        },
        {
          "condition": "Budgets differ, labels are ambiguous, a policy is tuned after held-out inspection, or a stratum has no auditable representation.",
          "interpretation": "retain-as-design-conflict"
        }
      ],
      "draftedOn": "2026-08-20",
      "evaluationLens": "measurement-reproducibility",
      "evaluationQuestion": "Under one fixed audit budget, can a coverage-aware re-audit policy expose more planted change patterns across a finite synthetic registry than recency-only, score-only, or uniform baselines?",
      "expiresAt": "2026-09-20T00:00:00Z",
      "expiryEffect": "FREEZE_AND_REQUIRE_NEW_HUMAN_REVIEW",
      "fixtures": [
        {
          "description": "A frozen finite registry with planted changes distributed across age, activity, and category strata for policy development.",
          "heldOut": false,
          "id": "synthetic-registry-development",
          "synthetic": true
        },
        {
          "description": "A separately authored finite registry with undisclosed planted labels until policies, budgets, and measures are frozen.",
          "heldOut": true,
          "id": "synthetic-registry-held-out",
          "synthetic": true
        }
      ],
      "id": "evaluation-plan:mcp-registry-drift:2026-08-20",
      "inputClass": "SELF-AUTHORED-SYNTHETIC-ONLY",
      "measures": [
        {
          "name": "planted-change-patterns-exposed",
          "rule": "Report the distinct pre-registered planted pattern labels exposed by each policy."
        },
        {
          "name": "strata-represented",
          "rule": "Report which age, activity, and category strata receive at least one audit."
        },
        {
          "name": "worst-stratum-coverage",
          "rule": "Report the least-covered pre-registered stratum without averaging it away."
        },
        {
          "name": "audit-budget",
          "rule": "Record consumed audit units and reject cross-policy interpretation if budgets differ."
        }
      ],
      "noRunState": "NO-RUN",
      "passingEffect": "RETAIN_FOR_SEPARATE_REVIEW_ONLY",
      "planState": "DRAFT",
      "questionProvenance": "Maintainer-authorized assisted synthetic question; exact text has not been human-reviewed, and the observed work's methods and claims have not been inspected.",
      "referralId": "referral:mcp-registry-drift:2026-08-20",
      "requestId": "evaluation-request:mcp-registry-drift:2026-08-20",
      "resourceEnvelope": {
        "artifactFetch": false,
        "credentials": false,
        "maxCases": 96,
        "maxInputBytes": 262144,
        "maxRuntimeSeconds": 20,
        "network": false,
        "persistentWrites": false,
        "personalData": false,
        "shell": false
      },
      "reversibility": {
        "cleanupRequired": false,
        "externalEffects": false,
        "reason": "Phase 0 records an inert plan only; no registry or policy is generated or run."
      },
      "rightsBlock": {
        "reason": "No source artifact, registry dataset, or implementation has been acquired and item-level reuse rights have not been reviewed.",
        "state": "BLOCKED_PENDING_ITEM_RIGHTS_REVIEW"
      },
      "schema": "kingdom.trial-evaluation-plan/0.1",
      "sealState": "UNSEALED",
      "securityBlock": {
        "reason": "No security preflight or capability-bounded runner exists for this plan.",
        "state": "BLOCKED_PENDING_SECURITY_PREFLIGHT"
      },
      "sourceMethodsKnown": false,
      "stopConditions": [
        "Stop if any live registry crawl, external artifact, network access, credential access, personal data, persistent write, shell, or artifact fetch would be required.",
        "Stop if policies are tuned after held-out inspection or if audit budgets are unequal.",
        "Stop if a planted label is ambiguous or any interpretation is presented as evidence of real registry drift.",
        "Stop on expiry or if a pinned Observatory identity or integrity signal changes."
      ],
      "threatModel": [
        "Policy tuning or label leakage may create circular evidence.",
        "Unequal budgets may masquerade as policy quality.",
        "Aggregate counts may hide a systematically neglected stratum.",
        "A finite synthetic registry cannot establish drift in a live MCP registry."
      ]
    },
    {
      "authorship": {
        "compiledBy": "codex-assisted-publication",
        "exactTextHumanReviewed": false,
        "humanDirectionRecorded": true,
        "origin": "maintainer-authorized-assisted-draft"
      },
      "controls": [
        "Freeze the envelope, minimal deny-by-default baseline, fixtures, expected labels, and allowed traces before any future classification.",
        "Use the same five finite traces and the same declared capabilities for the envelope and baseline.",
        "Preserve every per-trace category and reason; do not collapse them into a scalar outcome."
      ],
      "criterionRules": [
        {
          "condition": "The envelope identifies at least one pre-registered violation missed by the baseline and every allowed trace remains unchanged.",
          "interpretation": "retain-as-bounded-comparative-evidence"
        },
        {
          "condition": "The baseline identifies every violation that the envelope identifies.",
          "interpretation": "retain-as-no-observed-increment"
        },
        {
          "condition": "Any allowed trace changes classification or any reason cannot be traced to a frozen rule.",
          "interpretation": "retain-as-boundary-conflict"
        }
      ],
      "draftedOn": "2026-08-20",
      "evaluationLens": "security-model-clarity",
      "evaluationQuestion": "On finite, self-authored MCP traces, can a declared intent-and-capability envelope identify pre-registered boundary violations that a minimal deny-by-default baseline misses, without changing allowed traces?",
      "expiresAt": "2026-09-20T00:00:00Z",
      "expiryEffect": "FREEZE_AND_REQUIRE_NEW_HUMAN_REVIEW",
      "fixtures": [
        {
          "description": "A request whose declared intent, capability, arguments, and delegation all remain inside the frozen envelope.",
          "heldOut": false,
          "id": "allowed-request",
          "synthetic": true
        },
        {
          "description": "A request invokes a capability omitted from the frozen capability set.",
          "heldOut": false,
          "id": "undeclared-capability",
          "synthetic": true
        },
        {
          "description": "A delegated trace attempts to exercise authority that the delegating principal does not hold.",
          "heldOut": false,
          "id": "confused-deputy-delegation",
          "synthetic": true
        },
        {
          "description": "A request reuses an intent declaration outside its frozen validity window.",
          "heldOut": false,
          "id": "stale-intent",
          "synthetic": true
        },
        {
          "description": "An allowed capability is paired with an argument shape outside the frozen declaration.",
          "heldOut": true,
          "id": "argument-shape-attack",
          "synthetic": true
        }
      ],
      "id": "evaluation-plan:semantic-zero-trust-mcp:2026-08-20",
      "inputClass": "SELF-AUTHORED-SYNTHETIC-ONLY",
      "measures": [
        {
          "name": "per-trace-violation-identification",
          "rule": "Record the envelope and baseline categories and reasons against each pre-registered label."
        },
        {
          "name": "allowed-trace-preservation",
          "rule": "Record whether each pre-registered allowed trace is unchanged under the envelope."
        },
        {
          "name": "reason-traceability",
          "rule": "Map every classification reason to one frozen envelope or baseline rule."
        }
      ],
      "noRunState": "NO-RUN",
      "passingEffect": "RETAIN_FOR_SEPARATE_REVIEW_ONLY",